index	prefix	input_text	target_text	input_text_fa	target_text_fa	natural	natural_fa	natural_input_text_en	natural_target_text	natural_input_text_fa	natural_target_text_fa
496	xIntent	PersonX plays a ___ in PersonY's lives	to be involved in the existence of others	PersonX ___ در زندگی PersonY بازی می کند	در وجود دیگران دخیل باشد	PersonX plays a ___ in PersonY's lives. PersonX intends to be involved in the existence of others	PersonX ___ در زندگی PersonY بازی می کند. PersonX قصد دارد در وجود دیگران دخیل باشد	PersonX plays a ___ in PersonY's lives	 PersonX intends to be involved in the existence of others	PersonX ___ در زندگی PersonY بازی می کند	 PersonX قصد دارد در وجود دیگران دخیل باشد
497	xIntent	PersonX plays a ___ in PersonY's lives	to exert influence over events affecting others	PersonX ___ در زندگی PersonY بازی می کند	برای اعمال نفوذ بر وقایع مingثر بر دیگران	PersonX plays a ___ in PersonY's lives. PersonX intends to exert influence over events affecting others	PersonX ___ در زندگی PersonY بازی می کند. PersonX قصد دارد بر وقایع م affectثر بر دیگران تأثیر بگذارد	PersonX plays a ___ in PersonY's lives	 PersonX intends to exert influence over events affecting others	PersonX ___ در زندگی PersonY بازی می کند	 PersonX قصد دارد بر وقایع م affectثر بر دیگران تأثیر بگذارد
498	xIntent	PersonX leaves ___ soon	to get home	PersonX به زودی ___ را ترک می کند	رسیدن به خانه	PersonX leaves ___ soon. PersonX intends to get home	PersonX به زودی ___ را ترک می کند. PersonX قصد دارد به خانه خود برسد	PersonX leaves ___ soon	 PersonX intends to get home	PersonX به زودی ___ را ترک می کند	 PersonX قصد دارد به خانه خود برسد
499	xIntent	PersonX leaves ___ soon	to travel other countries	PersonX به زودی ___ را ترک می کند	برای سفر به کشورهای دیگر	PersonX leaves ___ soon. PersonX intends to travel other countries	PersonX به زودی ___ را ترک می کند. PersonX قصد دارد به کشورهای دیگر سفر کند	PersonX leaves ___ soon	 PersonX intends to travel other countries	PersonX به زودی ___ را ترک می کند	 PersonX قصد دارد به کشورهای دیگر سفر کند
500	xIntent	PersonX leaves ___ soon	to get another job	PersonX به زودی ___ را ترک می کند	برای گرفتن شغل دیگر	PersonX leaves ___ soon. PersonX intends to get another job	PersonX به زودی ___ را ترک می کند. PersonX قصد دارد شغل دیگری پیدا کند	PersonX leaves ___ soon	 PersonX intends to get another job	PersonX به زودی ___ را ترک می کند	 PersonX قصد دارد شغل دیگری پیدا کند
501	xIntent	PersonX leaves ___ soon	to travel	PersonX به زودی ___ را ترک می کند	سفر کردن	PersonX leaves ___ soon. PersonX intends to travel	PersonX به زودی ___ را ترک می کند. PersonX قصد سفر دارد	PersonX leaves ___ soon	 PersonX intends to travel	PersonX به زودی ___ را ترک می کند	 PersonX قصد سفر دارد
502	xIntent	PersonX leaves ___ soon	to stop some activity	PersonX به زودی ___ را ترک می کند	برای جلوگیری از برخی از فعالیت ها	PersonX leaves ___ soon. PersonX intends to stop some activity	PersonX به زودی ___ را ترک می کند. PersonX قصد دارد فعالیتی را متوقف کند	PersonX leaves ___ soon	 PersonX intends to stop some activity	PersonX به زودی ___ را ترک می کند	 PersonX قصد دارد فعالیتی را متوقف کند
503	xIntent	PersonX puts PersonX's ___ away	to tidy up	PersonX ___ PersonX را کنار می گذارد	مرتب کردن	PersonX puts PersonX's ___ away. PersonX intends to tidy up	PersonX ___ PersonX را کنار می گذارد. PersonX قصد دارد مرتب شود	PersonX puts PersonX's ___ away	 PersonX intends to tidy up	PersonX ___ PersonX را کنار می گذارد	 PersonX قصد دارد مرتب شود
504	xIntent	PersonX puts PersonX's ___ away	to be helpful	PersonX ___ PersonX را کنار می گذارد	مفید بودن	PersonX puts PersonX's ___ away. PersonX intends to be helpful	PersonX ___ PersonX را کنار می گذارد. PersonX قصد دارد مفید واقع شود	PersonX puts PersonX's ___ away	 PersonX intends to be helpful	PersonX ___ PersonX را کنار می گذارد	 PersonX قصد دارد مفید واقع شود
505	xIntent	PersonX puts PersonX's ___ away	to be nice	PersonX ___ PersonX را کنار می گذارد	خوب بودن	PersonX puts PersonX's ___ away. PersonX intends to be nice	PersonX ___ PersonX را کنار می گذارد. PersonX قصد دارد خوب باشد	PersonX puts PersonX's ___ away	 PersonX intends to be nice	PersonX ___ PersonX را کنار می گذارد	 PersonX قصد دارد خوب باشد
506	xIntent	PersonX confers upon PersonY the ___	to help person y	PersonX به PersonY ___ را اعطا می کند	برای کمک به شخص y	PersonX confers upon PersonY the ___. PersonX intends to help person y	PersonX به PersonY ___ را اعطا می کند. PersonX قصد دارد به شخص y کمک کند	PersonX confers upon PersonY the ___	 PersonX intends to help person y	PersonX به PersonY ___ را اعطا می کند	 PersonX قصد دارد به شخص y کمک کند
507	xIntent	PersonX learns PersonY's ___ well	to go higher in his life so he study others perception	PersonX ___ PersonY را به خوبی یاد می گیرد	تا در زندگی خود بالاتر برود ، بنابراین او درک دیگران را مطالعه می کند	PersonX learns PersonY's ___ well. PersonX intends to go higher in his life so he study others perception	PersonX ___ PersonY را به خوبی یاد می گیرد. PersonX قصد دارد در زندگی خود بالاتر برود ، بنابراین او درک دیگران را مطالعه می کند	PersonX learns PersonY's ___ well	 PersonX intends to go higher in his life so he study others perception	PersonX ___ PersonY را به خوبی یاد می گیرد	 PersonX قصد دارد در زندگی خود بالاتر برود ، بنابراین او درک دیگران را مطالعه می کند
508	xIntent	PersonX learns PersonY's ___ well	to be a good student	PersonX ___ PersonY را به خوبی یاد می گیرد	دانش آموز خوب بودن	PersonX learns PersonY's ___ well. PersonX intends to be a good student	PersonX ___ PersonY را به خوبی یاد می گیرد. PersonX قصد دارد دانش آموز خوبی باشد	PersonX learns PersonY's ___ well	 PersonX intends to be a good student	PersonX ___ PersonY را به خوبی یاد می گیرد	 PersonX قصد دارد دانش آموز خوبی باشد
509	xIntent	PersonX learns PersonY's ___ well	to be successful	PersonX ___ PersonY را به خوبی یاد می گیرد	برای موفق شدن	PersonX learns PersonY's ___ well. PersonX intends to be successful	PersonX ___ PersonY را به خوبی یاد می گیرد. PersonX قصد موفقیت دارد	PersonX learns PersonY's ___ well	 PersonX intends to be successful	PersonX ___ PersonY را به خوبی یاد می گیرد	 PersonX قصد موفقیت دارد
510	xIntent	PersonX learns PersonY's ___ well	to be courteous	PersonX ___ PersonY را به خوبی یاد می گیرد	مودب بودن	PersonX learns PersonY's ___ well. PersonX intends to be courteous	PersonX ___ PersonY را به خوبی یاد می گیرد. PersonX قصد دارد خوش برخورد باشد	PersonX learns PersonY's ___ well	 PersonX intends to be courteous	PersonX ___ PersonY را به خوبی یاد می گیرد	 PersonX قصد دارد خوش برخورد باشد
511	xIntent	PersonX hears god 's ___	to be saved	PersonX خدا را می شنود ___	نجات یافتن	PersonX hears god 's ___. PersonX intends to be saved	PersonX خدا را می شنود ___. PersonX قصد دارد ذخیره شود	PersonX hears god 's ___	 PersonX intends to be saved	PersonX خدا را می شنود ___	 PersonX قصد دارد ذخیره شود
512	xIntent	PersonX hears god 's ___	to find himself in religion	PersonX خدا را می شنود ___	خود را در دین پیدا کند	PersonX hears god 's ___. PersonX intends to find himself in religion	PersonX خدا را می شنود ___. PersonX قصد دارد خود را در دین پیدا کند	PersonX hears god 's ___	 PersonX intends to find himself in religion	PersonX خدا را می شنود ___	 PersonX قصد دارد خود را در دین پیدا کند
513	xIntent	PersonX left ___ to go	party	PersonX ___ را ترک کرد تا برود	مهمانی - جشن	PersonX left ___ to go. PersonX intends party	PersonX ___ را ترک کرد تا برود. PersonX قصد مهمانی دارد	PersonX left ___ to go	 PersonX intends party	PersonX ___ را ترک کرد تا برود	 PersonX قصد مهمانی دارد
514	xIntent	PersonX confesses PersonX's ___ before PersonY father	admit	PersonX قبل از پدر PersonY به ___ PersonX اعتراف می کند	اقرار کردن	PersonX confesses PersonX's ___ before PersonY father. PersonX intends admit	PersonX قبل از پدر PersonY به ___ PersonX اعتراف می کند. PersonX قصد دارد اعتراف کند	PersonX confesses PersonX's ___ before PersonY father	 PersonX intends admit	PersonX قبل از پدر PersonY به ___ PersonX اعتراف می کند	 PersonX قصد دارد اعتراف کند
515	xIntent	PersonX confesses PersonX's ___ before PersonY father	prove	PersonX قبل از پدر PersonY به ___ PersonX اعتراف می کند	ثابت كردن	PersonX confesses PersonX's ___ before PersonY father. PersonX intends prove	PersonX قبل از پدر PersonY به ___ PersonX اعتراف می کند. PersonX قصد دارد ثابت کند	PersonX confesses PersonX's ___ before PersonY father	 PersonX intends prove	PersonX قبل از پدر PersonY به ___ PersonX اعتراف می کند	 PersonX قصد دارد ثابت کند
516	xIntent	PersonX confesses PersonX's ___ before PersonY father	to introduce self	PersonX قبل از پدر PersonY به ___ PersonX اعتراف می کند	معرفی خود	PersonX confesses PersonX's ___ before PersonY father. PersonX intends to introduce self	PersonX قبل از پدر PersonY به ___ PersonX اعتراف می کند. PersonX قصد دارد خود را معرفی کند	PersonX confesses PersonX's ___ before PersonY father	 PersonX intends to introduce self	PersonX قبل از پدر PersonY به ___ PersonX اعتراف می کند	 PersonX قصد دارد خود را معرفی کند
517	xIntent	PersonX confesses PersonX's ___ before PersonY father	to be truthful	PersonX قبل از پدر PersonY به ___ PersonX اعتراف می کند	راستگو بودن	PersonX confesses PersonX's ___ before PersonY father. PersonX intends to be truthful	PersonX قبل از پدر PersonY به ___ PersonX اعتراف می کند. PersonX قصد دارد صادق باشد	PersonX confesses PersonX's ___ before PersonY father	 PersonX intends to be truthful	PersonX قبل از پدر PersonY به ___ PersonX اعتراف می کند	 PersonX قصد دارد صادق باشد
518	xIntent	PersonX keeps PersonX's ___ in order	to be clean	PersonX ___ PersonX را به ترتیب حفظ می کند	برای پاکیزه بودن	PersonX keeps PersonX's ___ in order. PersonX intends to be clean	PersonX ___ PersonX را به ترتیب حفظ می کند. PersonX قصد دارد تمیز باشد	PersonX keeps PersonX's ___ in order	 PersonX intends to be clean	PersonX ___ PersonX را به ترتیب حفظ می کند	 PersonX قصد دارد تمیز باشد
519	xIntent	PersonX translates PersonX's ___ into action	to be proactive	PersonX ___ PersonX را به عمل تبدیل می کند	پیش قدم بودن	PersonX translates PersonX's ___ into action. PersonX intends to be proactive	PersonX ___ PersonX را به عمل تبدیل می کند. PersonX قصد دارد فعالانه عمل کند	PersonX translates PersonX's ___ into action	 PersonX intends to be proactive	PersonX ___ PersonX را به عمل تبدیل می کند	 PersonX قصد دارد فعالانه عمل کند
520	xIntent	PersonX translates PersonX's ___ into action	the rest of the world to understand his writing	PersonX ___ PersonX را به عمل تبدیل می کند	بقیه دنیا برای درک نوشتار او	PersonX translates PersonX's ___ into action. PersonX intends the rest of the world to understand his writing	PersonX ___ PersonX را به عمل تبدیل می کند. PersonX قصد دارد بقیه دنیا نوشتن او را درک کنند	PersonX translates PersonX's ___ into action	 PersonX intends the rest of the world to understand his writing	PersonX ___ PersonX را به عمل تبدیل می کند	 PersonX قصد دارد بقیه دنیا نوشتن او را درک کنند
521	xIntent	PersonX bears this ___ in mind	to be mindful	PersonX این ___ را در ذهن دارد	هوشیار بودن	PersonX bears this ___ in mind. PersonX intends to be mindful	PersonX این ___ را در ذهن دارد. PersonX قصد دارد هوشیار باشد	PersonX bears this ___ in mind	 PersonX intends to be mindful	PersonX این ___ را در ذهن دارد	 PersonX قصد دارد هوشیار باشد
522	xIntent	PersonX chooses ___ from the menu	a certain food item	PersonX ___ را از فهرست انتخاب می کند	یک ماده غذایی خاص	PersonX chooses ___ from the menu. PersonX intends a certain food item	PersonX ___ را از فهرست انتخاب می کند. PersonX قصد دارد یک ماده غذایی خاص را ایجاد کند	PersonX chooses ___ from the menu	 PersonX intends a certain food item	PersonX ___ را از فهرست انتخاب می کند	 PersonX قصد دارد یک ماده غذایی خاص را ایجاد کند
523	xIntent	PersonX chooses ___ from the menu	folder from the menu	PersonX ___ را از فهرست انتخاب می کند	پوشه از فهرست	PersonX chooses ___ from the menu. PersonX intends folder from the menu	PersonX ___ را از فهرست انتخاب می کند. PersonX قصد دارد پوشه را از فهرست انتخاب کند	PersonX chooses ___ from the menu	 PersonX intends folder from the menu	PersonX ___ را از فهرست انتخاب می کند	 PersonX قصد دارد پوشه را از فهرست انتخاب کند
524	xIntent	PersonX chooses ___ from the menu	choose the product in online	PersonX ___ را از فهرست انتخاب می کند	محصول را بصورت آنلاین انتخاب کنید	PersonX chooses ___ from the menu. PersonX intends choose the product in online	PersonX ___ را از فهرست انتخاب می کند. PersonX قصد دارد این محصول را به صورت آنلاین انتخاب کند	PersonX chooses ___ from the menu	 PersonX intends choose the product in online	PersonX ___ را از فهرست انتخاب می کند	 PersonX قصد دارد این محصول را به صورت آنلاین انتخاب کند
525	xIntent	PersonX imports ___ from abroad	abroad chocolates	PersonX ___ را از خارج وارد می کند	شکلات های خارج از کشور	PersonX imports ___ from abroad. PersonX intends abroad chocolates	PersonX ___ را از خارج وارد می کند. PersonX قصد شکلات در خارج از کشور را دارد	PersonX imports ___ from abroad	 PersonX intends abroad chocolates	PersonX ___ را از خارج وارد می کند	 PersonX قصد شکلات در خارج از کشور را دارد
526	xIntent	PersonX imports ___ from abroad	to buy something from a foreign country	PersonX ___ را از خارج وارد می کند	برای خرید چیزی از یک کشور خارجی	PersonX imports ___ from abroad. PersonX intends to buy something from a foreign country	PersonX ___ را از خارج وارد می کند. PersonX قصد دارد چیزی را از یک کشور خارجی خریداری کند	PersonX imports ___ from abroad	 PersonX intends to buy something from a foreign country	PersonX ___ را از خارج وارد می کند	 PersonX قصد دارد چیزی را از یک کشور خارجی خریداری کند
527	xIntent	PersonX has the ___ well in hand	good	PersonX ___ را در دست دارد	خوب	PersonX has the ___ well in hand. PersonX intends good	PersonX ___ را در دست دارد. PersonX قصد خوبی دارد	PersonX has the ___ well in hand	 PersonX intends good	PersonX ___ را در دست دارد	 PersonX قصد خوبی دارد
528	xIntent	PersonX has the ___ well in hand	good world	PersonX ___ را در دست دارد	دنیای خوب	PersonX has the ___ well in hand. PersonX intends good world	PersonX ___ را در دست دارد. PersonX قصد دنیای خوب را دارد	PersonX has the ___ well in hand	 PersonX intends good world	PersonX ___ را در دست دارد	 PersonX قصد دنیای خوب را دارد
529	xIntent	PersonX executes every ___	wishes to make all happy	PersonX هر ___ را اجرا می کند	آرزو دارد همه را خوشحال کند	PersonX executes every ___. PersonX intends wishes to make all happy	PersonX هر ___ را اجرا می کند. PersonX آرزو دارد همه را خوشحال کند	PersonX executes every ___	 PersonX intends wishes to make all happy	PersonX هر ___ را اجرا می کند	 PersonX آرزو دارد همه را خوشحال کند
530	xIntent	PersonX traces PersonY's ___ back	to inform	PersonX ___ بازگشت PersonY را ردیابی می کند	خبر دادن	PersonX traces PersonY's ___ back. PersonX intends to inform	PersonX ___ بازگشت PersonY را ردیابی می کند. PersonX قصد دارد به اطلاع برساند	PersonX traces PersonY's ___ back	 PersonX intends to inform	PersonX ___ بازگشت PersonY را ردیابی می کند	 PersonX قصد دارد به اطلاع برساند
531	xIntent	PersonX traces PersonY's ___ back	to find out	PersonX ___ بازگشت PersonY را ردیابی می کند	برای کشف کردن	PersonX traces PersonY's ___ back. PersonX intends to find out	PersonX ___ بازگشت PersonY را ردیابی می کند. PersonX قصد دارد این موضوع را بفهمد	PersonX traces PersonY's ___ back	 PersonX intends to find out	PersonX ___ بازگشت PersonY را ردیابی می کند	 PersonX قصد دارد این موضوع را بفهمد
532	xIntent	PersonX traces PersonY's ___ back	to understand persony's roots	PersonX ___ بازگشت PersonY را ردیابی می کند	برای درک ریشه های شخصیت	PersonX traces PersonY's ___ back. PersonX intends to understand persony's roots	PersonX ___ بازگشت PersonY را ردیابی می کند. PersonX قصد دارد ریشه های شخصیت را درک کند	PersonX traces PersonY's ___ back	 PersonX intends to understand persony's roots	PersonX ___ بازگشت PersonY را ردیابی می کند	 PersonX قصد دارد ریشه های شخصیت را درک کند
533	xIntent	PersonX traces PersonY's ___ back	to explain persony's deficiencies	PersonX ___ بازگشت PersonY را ردیابی می کند	برای توضیح کمبودهای شخصیت	PersonX traces PersonY's ___ back. PersonX intends to explain persony's deficiencies	PersonX ___ بازگشت PersonY را ردیابی می کند. PersonX قصد دارد کمبودهای شخص را توضیح دهد	PersonX traces PersonY's ___ back	 PersonX intends to explain persony's deficiencies	PersonX ___ بازگشت PersonY را ردیابی می کند	 PersonX قصد دارد کمبودهای شخص را توضیح دهد
534	xIntent	PersonX manages PersonY's ___ in PersonY's way	to control	PersonX ___ PersonY را به روش PersonY مدیریت می کند	کنترل کردن	PersonX manages PersonY's ___ in PersonY's way. PersonX intends to control	PersonX ___ PersonY را به روش PersonY مدیریت می کند. PersonX قصد دارد کنترل کند	PersonX manages PersonY's ___ in PersonY's way	 PersonX intends to control	PersonX ___ PersonY را به روش PersonY مدیریت می کند	 PersonX قصد دارد کنترل کند
535	xIntent	PersonX manages PersonY's ___ in PersonY's way	to help persony the way persony likes to be helped	PersonX ___ PersonY را به روش PersonY مدیریت می کند	برای کمک به شخص به روشی که شخص دوست دارد به او کمک شود	PersonX manages PersonY's ___ in PersonY's way. PersonX intends to help persony the way persony likes to be helped	PersonX ___ PersonY را به روش PersonY مدیریت می کند. PersonX قصد دارد به همان روشی که شخص به او کمک می کند کمک کند	PersonX manages PersonY's ___ in PersonY's way	 PersonX intends to help persony the way persony likes to be helped	PersonX ___ PersonY را به روش PersonY مدیریت می کند	 PersonX قصد دارد به همان روشی که شخص به او کمک می کند کمک کند
536	xIntent	PersonX manages PersonY's ___ in PersonY's way	to follow the leadership style of another person	PersonX ___ PersonY را به روش PersonY مدیریت می کند	برای پیروی از سبک رهبری شخص دیگری	PersonX manages PersonY's ___ in PersonY's way. PersonX intends to follow the leadership style of another person	PersonX ___ PersonY را به روش PersonY مدیریت می کند. PersonX قصد دارد از سبک رهبری شخص دیگری پیروی کند	PersonX manages PersonY's ___ in PersonY's way	 PersonX intends to follow the leadership style of another person	PersonX ___ PersonY را به روش PersonY مدیریت می کند	 PersonX قصد دارد از سبک رهبری شخص دیگری پیروی کند
537	xIntent	PersonX grants ___ the right	to improve others' lives	PersonX به ___ حق اعطا می کند	برای بهبود زندگی دیگران	PersonX grants ___ the right. PersonX intends to improve others' lives	PersonX به ___ حق اعطا می کند. PersonX قصد دارد زندگی دیگران را بهبود بخشد	PersonX grants ___ the right	 PersonX intends to improve others' lives	PersonX به ___ حق اعطا می کند	 PersonX قصد دارد زندگی دیگران را بهبود بخشد
538	xIntent	PersonX grants ___ the right	to empower others	PersonX به ___ حق اعطا می کند	برای توانمند سازی دیگران	PersonX grants ___ the right. PersonX intends to empower others	PersonX به ___ حق اعطا می کند. PersonX قصد دارد به دیگران قدرت بخشد	PersonX grants ___ the right	 PersonX intends to empower others	PersonX به ___ حق اعطا می کند	 PersonX قصد دارد به دیگران قدرت بخشد
539	xIntent	PersonX holds ___ and to receive	holds the metrial and to receive	PersonX ___ و برای دریافت را نگه می دارد	متریال را نگه می دارد و برای دریافت	PersonX holds ___ and to receive. PersonX intends holds the metrial and to receive	PersonX ___ و برای دریافت را نگه می دارد. PersonX قصد دارد متریال و دریافت را انجام دهد	PersonX holds ___ and to receive	 PersonX intends holds the metrial and to receive	PersonX ___ و برای دریافت را نگه می دارد	 PersonX قصد دارد متریال و دریافت را انجام دهد
540	xIntent	PersonX thanks the ___ for a grant	producer	PersonX از ___ بابت کمک مالی تشکر می کند	تهیه کننده	PersonX thanks the ___ for a grant. PersonX intends producer	PersonX از ___ بابت کمک مالی تشکر می کند. PersonX قصد تولید دارد	PersonX thanks the ___ for a grant	 PersonX intends producer	PersonX از ___ بابت کمک مالی تشکر می کند	 PersonX قصد تولید دارد
541	xIntent	PersonX thanks the ___ for a grant	to appear grateful	PersonX از ___ بابت کمک مالی تشکر می کند	سپاسگزار به نظر برسد	PersonX thanks the ___ for a grant. PersonX intends to appear grateful	PersonX از ___ بابت کمک مالی تشکر می کند. PersonX قصد دارد سپاسگزار به نظر برسد	PersonX thanks the ___ for a grant	 PersonX intends to appear grateful	PersonX از ___ بابت کمک مالی تشکر می کند	 PersonX قصد دارد سپاسگزار به نظر برسد
542	xIntent	PersonX covets PersonX's neighbor 's ___	what their neighbor has	PersonX آرزو می کند همسایه PersonX همسایه ___	آنچه همسایه آنها دارد	PersonX covets PersonX's neighbor 's ___. PersonX intends what their neighbor has	PersonX به همسایه PersonX همسایه ___ آرزو می کند. PersonX قصد همسایه خود را دارد	PersonX covets PersonX's neighbor 's ___	 PersonX intends what their neighbor has	PersonX به همسایه PersonX همسایه ___ آرزو می کند	 PersonX قصد همسایه خود را دارد
