index	prefix	input_text	target_text	input_text_fa	target_text_fa	natural	natural_fa	natural_input_text_en	natural_target_text	natural_input_text_fa	natural_target_text_fa
740	xIntent	PersonX comes ___ tonight	still annoyed	PersonX امشب ___ میاد	هنوز اذیت	PersonX comes ___ tonight. PersonX intends still annoyed	PersonX امشب ___ میاد. PersonX هنوز هم آزار دارد	PersonX comes ___ tonight	 PersonX intends still annoyed	PersonX امشب ___ میاد	 PersonX هنوز هم آزار دارد
741	xIntent	PersonX comes ___ tonight	to get back	PersonX امشب ___ میاد	برگشتن	PersonX comes ___ tonight. PersonX intends to get back	PersonX امشب ___ میاد. PersonX قصد دارد دوباره برگردد	PersonX comes ___ tonight	 PersonX intends to get back	PersonX امشب ___ میاد	 PersonX قصد دارد دوباره برگردد
742	xIntent	PersonX keeps ___ under control	to dominate	PersonX ___ را کنترل می کند	مسلط شدن	PersonX keeps ___ under control. PersonX intends to dominate	PersonX ___ را کنترل می کند. PersonX قصد سلطه دارد	PersonX keeps ___ under control	 PersonX intends to dominate	PersonX ___ را کنترل می کند	 PersonX قصد سلطه دارد
743	xIntent	PersonX pushes back the ___	to get out	PersonX ___ را عقب می اندازد	بیرون آمدن	PersonX pushes back the ___. PersonX intends to get out	PersonX ___ را عقب می زند. PersonX قصد دارد خارج شود	PersonX pushes back the ___	 PersonX intends to get out	PersonX ___ را عقب می زند	 PersonX قصد دارد خارج شود
744	xIntent	PersonX loves ___ above all things	to be individualistic	PersonX بیش از همه چیز ___ را دوست دارد	فرد گرا بودن	PersonX loves ___ above all things. PersonX intends to be individualistic	PersonX بیش از همه چیز ___ را دوست دارد. PersonX قصد دارد فردگرا باشد	PersonX loves ___ above all things	 PersonX intends to be individualistic	PersonX بیش از همه چیز ___ را دوست دارد	 PersonX قصد دارد فردگرا باشد
745	xIntent	PersonX loves ___ above all things	to be confident in tastes	PersonX بیش از همه چیز ___ را دوست دارد	به سلیقه اعتماد داشته باشم	PersonX loves ___ above all things. PersonX intends to be confident in tastes	PersonX بیش از همه چیز ___ را دوست دارد. PersonX قصد دارد به سلیقه اعتماد کند	PersonX loves ___ above all things	 PersonX intends to be confident in tastes	PersonX بیش از همه چیز ___ را دوست دارد	 PersonX قصد دارد به سلیقه اعتماد کند
746	xIntent	PersonX loves ___ above all things	the person was love all the things	PersonX بیش از همه چیز ___ را دوست دارد	شخص عاشق همه چیز بود	PersonX loves ___ above all things. PersonX intends the person was love all the things	PersonX بیش از همه چیز ___ را دوست دارد. PersonX قصد دارد این شخص همه چیز را دوست داشته باشد	PersonX loves ___ above all things	 PersonX intends the person was love all the things	PersonX بیش از همه چیز ___ را دوست دارد	 PersonX قصد دارد این شخص همه چیز را دوست داشته باشد
747	xIntent	PersonX raises ___ to finance	to be well off, earn,  happy because has money	PersonX ___ را برای تأمین مالی بالا می برد	داشتن پول خوب ، درآمد ، شاد بودن	PersonX raises ___ to finance. PersonX intends to be well off, earn,  happy because has money	PersonX ___ را برای تأمین مالی بالا می برد. PersonX قصد دارد که از پس درآمد بالایی برخوردار باشد ، خوشحال و شاد باشد	PersonX raises ___ to finance	 PersonX intends to be well off, earn,  happy because has money	PersonX ___ را برای تأمین مالی بالا می برد	 PersonX قصد دارد که از پس درآمد بالایی برخوردار باشد ، خوشحال و شاد باشد
748	xIntent	PersonX raises ___ to finance	to help the company	PersonX ___ را برای تأمین مالی بالا می برد	برای کمک به شرکت	PersonX raises ___ to finance. PersonX intends to help the company	PersonX ___ را برای تأمین مالی بالا می برد. PersonX قصد دارد به این شرکت کمک کند	PersonX raises ___ to finance	 PersonX intends to help the company	PersonX ___ را برای تأمین مالی بالا می برد	 PersonX قصد دارد به این شرکت کمک کند
749	xIntent	PersonX knows this ___ well	to create a data about nation	PersonX این را خوب می داند ___	برای ایجاد یک داده در مورد ملت	PersonX knows this ___ well. PersonX intends to create a data about nation	PersonX این را خوب می داند ___. PersonX قصد دارد یک داده در مورد کشور ایجاد کند	PersonX knows this ___ well	 PersonX intends to create a data about nation	PersonX این را خوب می داند ___	 PersonX قصد دارد یک داده در مورد کشور ایجاد کند
750	xIntent	PersonX knows this ___ well	to establish his knowledge	PersonX این را خوب می داند ___	دانش خود را تأسیس کند	PersonX knows this ___ well. PersonX intends to establish his knowledge	PersonX این را خوب می داند ___. PersonX قصد دارد دانش خود را ایجاد کند	PersonX knows this ___ well	 PersonX intends to establish his knowledge	PersonX این را خوب می داند ___	 PersonX قصد دارد دانش خود را ایجاد کند
751	xIntent	PersonX works ___ to make	tired of yelling	PersonX برای ساختن ___ کار می کند	از داد زدن خسته شده	PersonX works ___ to make. PersonX intends tired of yelling	PersonX برای ساختن ___ کار می کند. PersonX قصد دارد از داد زدن خسته شود	PersonX works ___ to make	 PersonX intends tired of yelling	PersonX برای ساختن ___ کار می کند	 PersonX قصد دارد از داد زدن خسته شود
752	xIntent	PersonX works ___ to make	to be more money	PersonX برای ساختن ___ کار می کند	پول بیشتر بودن	PersonX works ___ to make. PersonX intends to be more money	PersonX برای ساختن ___ کار می کند. PersonX قصد دارد پول بیشتری داشته باشد	PersonX works ___ to make	 PersonX intends to be more money	PersonX برای ساختن ___ کار می کند	 PersonX قصد دارد پول بیشتری داشته باشد
753	xIntent	PersonX sends ___ to the congress	driven and purposeful for sending people	PersonX ___ را به کنگره می فرستد	برای اعزام به مردم هدایت شده و هدفمند است	PersonX sends ___ to the congress. PersonX intends driven and purposeful for sending people	PersonX ___ را به کنگره می فرستد. PersonX برای اعزام به افراد هدایت شده و هدفمند است	PersonX sends ___ to the congress	 PersonX intends driven and purposeful for sending people	PersonX ___ را به کنگره می فرستد	 PersonX برای اعزام به افراد هدایت شده و هدفمند است
754	xIntent	PersonX sends ___ to the congress	to watch something interesting	PersonX ___ را به کنگره می فرستد	برای تماشای یک چیز جالب	PersonX sends ___ to the congress. PersonX intends to watch something interesting	PersonX ___ را به کنگره می فرستد. PersonX قصد دارد چیز جالبی را تماشا کند	PersonX sends ___ to the congress	 PersonX intends to watch something interesting	PersonX ___ را به کنگره می فرستد	 PersonX قصد دارد چیز جالبی را تماشا کند
755	xIntent	PersonX wears every ___	to show off	PersonX هر ___ را می پوشد	خودنمایی کردن	PersonX wears every ___. PersonX intends to show off	PersonX هر ___ را می پوشد. PersonX قصد دارد خودنمایی کند	PersonX wears every ___	 PersonX intends to show off	PersonX هر ___ را می پوشد	 PersonX قصد دارد خودنمایی کند
756	xIntent	PersonX wears every ___	to be important to wear	PersonX هر ___ را می پوشد	پوشیدن مهم باشد	PersonX wears every ___. PersonX intends to be important to wear	PersonX هر ___ را می پوشد. PersonX قصد دارد که پوشیدن از اهمیت بالایی برخوردار باشد	PersonX wears every ___	 PersonX intends to be important to wear	PersonX هر ___ را می پوشد	 PersonX قصد دارد که پوشیدن از اهمیت بالایی برخوردار باشد
757	xIntent	PersonX brings ___ under cultivation	to start a farm	PersonX ___ را تحت کشت قرار می دهد	برای راه اندازی مزرعه	PersonX brings ___ under cultivation. PersonX intends to start a farm	PersonX ___ را تحت کشت قرار می دهد. PersonX قصد دارد مزرعه ای راه اندازی کند	PersonX brings ___ under cultivation	 PersonX intends to start a farm	PersonX ___ را تحت کشت قرار می دهد	 PersonX قصد دارد مزرعه ای راه اندازی کند
758	xIntent	PersonX brings ___ under cultivation	to grow food	PersonX ___ را تحت کشت قرار می دهد	برای پرورش غذا	PersonX brings ___ under cultivation. PersonX intends to grow food	PersonX ___ را تحت کشت قرار می دهد. PersonX قصد دارد مواد غذایی تولید کند	PersonX brings ___ under cultivation	 PersonX intends to grow food	PersonX ___ را تحت کشت قرار می دهد	 PersonX قصد دارد مواد غذایی تولید کند
759	xIntent	PersonX turns ___ into day	to perform a miracle	PersonX ___ را به روز تبدیل می کند	انجام معجزه	PersonX turns ___ into day. PersonX intends to perform a miracle	PersonX ___ را به روز تبدیل می کند. PersonX قصد دارد معجزه کند	PersonX turns ___ into day	 PersonX intends to perform a miracle	PersonX ___ را به روز تبدیل می کند	 PersonX قصد دارد معجزه کند
760	xIntent	PersonX turns the ___ to PersonX's advantage	to be in control of the situation	PersonX ___ را به مزیت PersonX تبدیل می کند	برای کنترل اوضاع	PersonX turns the ___ to PersonX's advantage. PersonX intends to be in control of the situation	PersonX ___ را به مزیت PersonX تبدیل می کند. PersonX قصد دارد شرایط را کنترل کند	PersonX turns the ___ to PersonX's advantage	 PersonX intends to be in control of the situation	PersonX ___ را به مزیت PersonX تبدیل می کند	 PersonX قصد دارد شرایط را کنترل کند
761	xIntent	PersonX gathers together the ___	to hold a meeting	PersonX ___ را با هم جمع می کند	برگزار کردن جلسه	PersonX gathers together the ___. PersonX intends to hold a meeting	PersonX ___ را با هم جمع می کند. PersonX قصد دارد جلسه ای برگزار کند	PersonX gathers together the ___	 PersonX intends to hold a meeting	PersonX ___ را با هم جمع می کند	 PersonX قصد دارد جلسه ای برگزار کند
762	xIntent	PersonX gathers together the ___	to make an announcement	PersonX ___ را با هم جمع می کند	اعلامیه	PersonX gathers together the ___. PersonX intends to make an announcement	PersonX ___ را با هم جمع می کند. PersonX قصد دارد اعلامیه ای اعلام کند	PersonX gathers together the ___	 PersonX intends to make an announcement	PersonX ___ را با هم جمع می کند	 PersonX قصد دارد اعلامیه ای اعلام کند
763	xIntent	PersonX gathers together the ___	to form a joined whole	PersonX ___ را با هم جمع می کند	برای تشکیل یک کل پیوسته	PersonX gathers together the ___. PersonX intends to form a joined whole	PersonX ___ را با هم جمع می کند. PersonX قصد دارد یک کل پیوسته را تشکیل دهد	PersonX gathers together the ___	 PersonX intends to form a joined whole	PersonX ___ را با هم جمع می کند	 PersonX قصد دارد یک کل پیوسته را تشکیل دهد
764	xIntent	PersonX gathers together the ___	to know the information about the unknown persons	PersonX ___ را با هم جمع می کند	برای دانستن اطلاعات مربوط به افراد ناشناس	PersonX gathers together the ___. PersonX intends to know the information about the unknown persons	PersonX ___ را با هم جمع می کند. PersonX قصد دارد اطلاعات مربوط به افراد ناشناس را بداند	PersonX gathers together the ___	 PersonX intends to know the information about the unknown persons	PersonX ___ را با هم جمع می کند	 PersonX قصد دارد اطلاعات مربوط به افراد ناشناس را بداند
765	xIntent	PersonX includes ___ well	to be thorough	PersonX شامل ___ خوب است	کامل بودن	PersonX includes ___ well. PersonX intends to be thorough	PersonX به خوبی شامل ___ می شود. PersonX قصد دارد کامل باشد	PersonX includes ___ well	 PersonX intends to be thorough	PersonX به خوبی شامل ___ می شود	 PersonX قصد دارد کامل باشد
766	xIntent	PersonX supplies the ___ with food	to supply food	PersonX ___ را با غذا تأمین می کند	برای تأمین غذا	PersonX supplies the ___ with food. PersonX intends to supply food	PersonX ___ را با غذا تأمین می کند. PersonX قصد دارد مواد غذایی تهیه کند	PersonX supplies the ___ with food	 PersonX intends to supply food	PersonX ___ را با غذا تأمین می کند	 PersonX قصد دارد مواد غذایی تهیه کند
767	xIntent	PersonX supplies the ___ with food	to give back as much as have been given	PersonX ___ را با غذا تأمین می کند	به همان مقدار که داده شده پس بدهم	PersonX supplies the ___ with food. PersonX intends to give back as much as have been given	PersonX ___ را با غذا تأمین می کند. PersonX قصد دارد به همان اندازه که داده شده است پس دهد	PersonX supplies the ___ with food	 PersonX intends to give back as much as have been given	PersonX ___ را با غذا تأمین می کند	 PersonX قصد دارد به همان اندازه که داده شده است پس دهد
768	xIntent	PersonX gathers the ___ together	to plan the party	PersonX ___ را با هم جمع می کند	برای برنامه ریزی مهمانی	PersonX gathers the ___ together. PersonX intends to plan the party	PersonX ___ را با هم جمع می کند. PersonX قصد دارد برای مهمانی برنامه ریزی کند	PersonX gathers the ___ together	 PersonX intends to plan the party	PersonX ___ را با هم جمع می کند	 PersonX قصد دارد برای مهمانی برنامه ریزی کند
769	xIntent	PersonX puts PersonY's ___ away	wants something to end	PersonX PersonY's ___ را کنار می گذارد	می خواهد چیزی به پایان برسد	PersonX puts PersonY's ___ away. PersonX intends wants something to end	PersonX PersonY's ___ را کنار می گذارد. PersonX قصد دارد کاری پایان یابد	PersonX puts PersonY's ___ away	 PersonX intends wants something to end	PersonX PersonY's ___ را کنار می گذارد	 PersonX قصد دارد کاری پایان یابد
770	xIntent	PersonX puts PersonY's ___ away	wants to put aside something	PersonX PersonY's ___ را کنار می گذارد	می خواهد چیزی را کنار بگذارد	PersonX puts PersonY's ___ away. PersonX intends wants to put aside something	PersonX PersonY's ___ را کنار می گذارد. PersonX قصد دارد چیزی را کنار بگذارد	PersonX puts PersonY's ___ away	 PersonX intends wants to put aside something	PersonX PersonY's ___ را کنار می گذارد	 PersonX قصد دارد چیزی را کنار بگذارد
771	xIntent	PersonX puts PersonY's ___ away	to care for them	PersonX PersonY's ___ را کنار می گذارد	برای مراقبت از آنها	PersonX puts PersonY's ___ away. PersonX intends to care for them	PersonX PersonY's ___ را کنار می گذارد. PersonX قصد دارد از آنها مراقبت کند	PersonX puts PersonY's ___ away	 PersonX intends to care for them	PersonX PersonY's ___ را کنار می گذارد	 PersonX قصد دارد از آنها مراقبت کند
772	xIntent	PersonX puts PersonY's ___ away	to help to others	PersonX PersonY's ___ را کنار می گذارد	برای کمک به دیگران	PersonX puts PersonY's ___ away. PersonX intends to help to others	PersonX PersonY's ___ را کنار می گذارد. PersonX قصد دارد به دیگران کمک کند	PersonX puts PersonY's ___ away	 PersonX intends to help to others	PersonX PersonY's ___ را کنار می گذارد	 PersonX قصد دارد به دیگران کمک کند
773	xIntent	PersonX likes ___ well	like oters	PersonX ___ خوب را دوست دارد	مثل بخورها	PersonX likes ___ well. PersonX intends like oters	PersonX ___ خوب را دوست دارد. PersonX قصد دارد مانند oters باشد	PersonX likes ___ well	 PersonX intends like oters	PersonX ___ خوب را دوست دارد	 PersonX قصد دارد مانند oters باشد
774	xIntent	PersonX calls a ___ to consider	to get others' opinions	PersonX با یک ___ تماس می گیرد تا در نظر بگیرد	برای گرفتن نظرات دیگران	PersonX calls a ___ to consider. PersonX intends to get others' opinions	PersonX با یک ___ تماس می گیرد تا در نظر بگیرد. PersonX قصد دارد نظرات دیگران را جلب کند	PersonX calls a ___ to consider	 PersonX intends to get others' opinions	PersonX با یک ___ تماس می گیرد تا در نظر بگیرد	 PersonX قصد دارد نظرات دیگران را جلب کند
775	xIntent	PersonX calls a ___ to consider	to build a consensus	PersonX با یک ___ تماس می گیرد تا در نظر بگیرد	برای ایجاد یک اجماع	PersonX calls a ___ to consider. PersonX intends to build a consensus	PersonX با یک ___ تماس می گیرد تا در نظر بگیرد. PersonX قصد دارد یک اجماع ایجاد کند	PersonX calls a ___ to consider	 PersonX intends to build a consensus	PersonX با یک ___ تماس می گیرد تا در نظر بگیرد	 PersonX قصد دارد یک اجماع ایجاد کند
776	xIntent	PersonX persuades the ___ to give	to achieve something	PersonX ___ را ترغیب می کند که بدهد	برای رسیدن به چیزی	PersonX persuades the ___ to give. PersonX intends to achieve something	PersonX ___ را ترغیب می کند که بدهد. PersonX قصد دارد به چیزی دست یابد	PersonX persuades the ___ to give	 PersonX intends to achieve something	PersonX ___ را ترغیب می کند که بدهد	 PersonX قصد دارد به چیزی دست یابد
777	xIntent	PersonX prevents ___ from running	to stop running	PersonX از اجرای ___ جلوگیری می کند	دویدن را متوقف کند	PersonX prevents ___ from running. PersonX intends to stop running	PersonX از اجرای ___ جلوگیری می کند. PersonX قصد دارد دویدن را متوقف کند	PersonX prevents ___ from running	 PersonX intends to stop running	PersonX از اجرای ___ جلوگیری می کند	 PersonX قصد دارد دویدن را متوقف کند
778	xIntent	PersonX pushes PersonX's ___ away	to get something out of their way	PersonX PersonX را ___ دور می کند	تا چیزی را از سر راه خود بردارند	PersonX pushes PersonX's ___ away. PersonX intends to get something out of their way	PersonX PersonX را ___ دور می کند. PersonX قصد دارد چیزی را از سر راه خود بردارد	PersonX pushes PersonX's ___ away	 PersonX intends to get something out of their way	PersonX PersonX را ___ دور می کند	 PersonX قصد دارد چیزی را از سر راه خود بردارد
779	xIntent	PersonX pushes PersonX's ___ away	to be free	PersonX PersonX را ___ دور می کند	آزاد بودن	PersonX pushes PersonX's ___ away. PersonX intends to be free	PersonX PersonX را ___ دور می کند. PersonX قصد دارد رایگان باشد	PersonX pushes PersonX's ___ away	 PersonX intends to be free	PersonX PersonX را ___ دور می کند	 PersonX قصد دارد رایگان باشد
780	xIntent	PersonX persuades ___ to adopt	to feel clever	PersonX ___ را ترغیب می کند که فرزندخواندگی کند	باهوش بودن	PersonX persuades ___ to adopt. PersonX intends to feel clever	PersonX ___ را ترغیب می کند که فرزندخواندگی کند. PersonX قصد دارد باهوش باشد	PersonX persuades ___ to adopt	 PersonX intends to feel clever	PersonX ___ را ترغیب می کند که فرزندخواندگی کند	 PersonX قصد دارد باهوش باشد
781	xIntent	PersonX persuades ___ to adopt	to persuade others	PersonX ___ را ترغیب می کند که فرزندخواندگی کند	برای ترغیب دیگران	PersonX persuades ___ to adopt. PersonX intends to persuade others	PersonX ___ را ترغیب می کند که فرزندخواندگی کند. PersonX قصد دارد دیگران را ترغیب کند	PersonX persuades ___ to adopt	 PersonX intends to persuade others	PersonX ___ را ترغیب می کند که فرزندخواندگی کند	 PersonX قصد دارد دیگران را ترغیب کند
782	xIntent	PersonX persuades ___ to adopt	situation	PersonX ___ را ترغیب می کند که فرزندخواندگی کند	وضعیت	PersonX persuades ___ to adopt. PersonX intends situation	PersonX ___ را ترغیب می کند که فرزندخواندگی کند. PersonX قصد وضعیت دارد	PersonX persuades ___ to adopt	 PersonX intends situation	PersonX ___ را ترغیب می کند که فرزندخواندگی کند	 PersonX قصد وضعیت دارد
783	xIntent	PersonX separates the ___ from the goats	difference between to goats	PersonX ___ را از بزها جدا می کند	تفاوت بین بزها	PersonX separates the ___ from the goats. PersonX intends difference between to goats	PersonX ___ را از بزها جدا می کند. PersonX قصد دارد تفاوت بین بزها باشد	PersonX separates the ___ from the goats	 PersonX intends difference between to goats	PersonX ___ را از بزها جدا می کند	 PersonX قصد دارد تفاوت بین بزها باشد
784	xIntent	PersonX joins the king 's ___	to get job	PersonX به عضو ___ پادشاه می پیوندد	شغل گرفتن	PersonX joins the king 's ___. PersonX intends to get job	PersonX به ___ پادشاه پیوست. PersonX قصد دارد شغل پیدا کند	PersonX joins the king 's ___	 PersonX intends to get job	PersonX به ___ پادشاه پیوست	 PersonX قصد دارد شغل پیدا کند
785	xIntent	PersonX joins the king 's ___	i like join the king forces	PersonX به عضو ___ پادشاه می پیوندد	من دوست دارم به نیروهای پادشاه ملحق شوم	PersonX joins the king 's ___. PersonX intends i like join the king forces	PersonX به ___ پادشاه پیوست. PersonX قصد دارد من به نیروهای پادشاه ملحق شوم	PersonX joins the king 's ___	 PersonX intends i like join the king forces	PersonX به ___ پادشاه پیوست	 PersonX قصد دارد من به نیروهای پادشاه ملحق شوم
786	xIntent	PersonX joins the king 's ___	to serve	PersonX به عضو ___ پادشاه می پیوندد	برای خدمت	PersonX joins the king 's ___. PersonX intends to serve	PersonX به ___ پادشاه پیوست. PersonX قصد دارد خدمت کند	PersonX joins the king 's ___	 PersonX intends to serve	PersonX به ___ پادشاه پیوست	 PersonX قصد دارد خدمت کند
787	xIntent	PersonX joins the king 's ___	to be included	PersonX به عضو ___ پادشاه می پیوندد	شامل شود	PersonX joins the king 's ___. PersonX intends to be included	PersonX به ___ پادشاه پیوست. PersonX در نظر گرفته شده است	PersonX joins the king 's ___	 PersonX intends to be included	PersonX به ___ پادشاه پیوست	 PersonX در نظر گرفته شده است
788	xIntent	PersonX monitors the patient 's ___	to make sure he's alive	PersonX ___ بیمار را کنترل می کند	تا مطمئن شوم زنده است	PersonX monitors the patient 's ___. PersonX intends to make sure he's alive	PersonX ___ بیمار را کنترل می کند. PersonX قصد دارد از زنده بودن او اطمینان حاصل کند	PersonX monitors the patient 's ___	 PersonX intends to make sure he's alive	PersonX ___ بیمار را کنترل می کند	 PersonX قصد دارد از زنده بودن او اطمینان حاصل کند
