index	prefix	input_text	target_text	input_text_fa	target_text_fa	natural	natural_fa	natural_input_text_en	natural_target_text	natural_input_text_fa	natural_target_text_fa
252	xIntent	PersonX prevents ___ within the group	person from fever	PersonX از ___ درون گروه جلوگیری می کند	فرد از تب	PersonX prevents ___ within the group. PersonX intends person from fever	PersonX از ___ درون گروه جلوگیری می کند. PersonX فرد را از تب قصد دارد	PersonX prevents ___ within the group	 PersonX intends person from fever	PersonX از ___ درون گروه جلوگیری می کند	 PersonX فرد را از تب قصد دارد
253	xIntent	PersonX casts ___ upon the earth	cat a seed and green earth	PersonX ___ را روی زمین می اندازد	گربه یک دانه و زمین سبز	PersonX casts ___ upon the earth. PersonX intends cat a seed and green earth	PersonX ___ را روی زمین می اندازد. PersonX قصد دارد یک دانه و یک زمین سبز برای گربه ارائه دهد	PersonX casts ___ upon the earth	 PersonX intends cat a seed and green earth	PersonX ___ را روی زمین می اندازد	 PersonX قصد دارد یک دانه و یک زمین سبز برای گربه ارائه دهد
254	xIntent	PersonX plays a ___ in causing	to contribute himself	PersonX در ایجاد ___ بازی می کند	خودش کمک کند	PersonX plays a ___ in causing. PersonX intends to contribute himself	PersonX در ایجاد ___ بازی می کند. PersonX قصد دارد خودش کمک کند	PersonX plays a ___ in causing	 PersonX intends to contribute himself	PersonX در ایجاد ___ بازی می کند	 PersonX قصد دارد خودش کمک کند
255	xIntent	PersonX gratifies every ___	to show his good side	PersonX هر ___ را تحسین می کند	تا جنبه خوب خود را نشان دهد	PersonX gratifies every ___. PersonX intends to show his good side	PersonX هر ___ را تحسین می کند. PersonX قصد دارد جنبه خوب خود را نشان دهد	PersonX gratifies every ___	 PersonX intends to show his good side	PersonX هر ___ را تحسین می کند	 PersonX قصد دارد جنبه خوب خود را نشان دهد
256	xIntent	PersonX gratifies every ___	to be appreciative	PersonX هر ___ را تحسین می کند	قدردان بودن	PersonX gratifies every ___. PersonX intends to be appreciative	PersonX هر ___ را تحسین می کند. PersonX قصد دارد قدردانی کند	PersonX gratifies every ___	 PersonX intends to be appreciative	PersonX هر ___ را تحسین می کند	 PersonX قصد دارد قدردانی کند
257	xIntent	PersonX drives home the ___	to make something very clear.	PersonX به خانه ___ رانندگی می کند	برای روشن کردن چیزی	PersonX drives home the ___. PersonX intends to make something very clear.	PersonX ___ را به خانه هدایت می کند. PersonX قصد دارد موضوعی را به روشنی بیان کند.	PersonX drives home the ___	 PersonX intends to make something very clear	PersonX ___ را به خانه هدایت می کند	 PersonX قصد دارد موضوعی را به روشنی بیان کند
258	xIntent	PersonX drives home the ___	to be prevent	PersonX به خانه ___ رانندگی می کند	جلوگیری شود	PersonX drives home the ___. PersonX intends to be prevent	PersonX ___ را به خانه هدایت می کند. PersonX قصد دارد جلوی آن گرفته شود	PersonX drives home the ___	 PersonX intends to be prevent	PersonX ___ را به خانه هدایت می کند	 PersonX قصد دارد جلوی آن گرفته شود
259	xIntent	PersonX increases the ___ by increasing	to gain more of the amount	PersonX با افزایش ___ را افزایش می دهد	برای به دست آوردن مقدار بیشتر	PersonX increases the ___ by increasing. PersonX intends to gain more of the amount	PersonX با افزایش ___ را افزایش می دهد. PersonX قصد دارد مبلغ بیشتری را به دست آورد	PersonX increases the ___ by increasing	 PersonX intends to gain more of the amount	PersonX با افزایش ___ را افزایش می دهد	 PersonX قصد دارد مبلغ بیشتری را به دست آورد
260	xIntent	PersonX increases the ___ by increasing	to gain more money	PersonX با افزایش ___ را افزایش می دهد	برای به دست آوردن پول بیشتر	PersonX increases the ___ by increasing. PersonX intends to gain more money	PersonX با افزایش ___ را افزایش می دهد. PersonX قصد دارد پول بیشتری بدست آورد	PersonX increases the ___ by increasing	 PersonX intends to gain more money	PersonX با افزایش ___ را افزایش می دهد	 PersonX قصد دارد پول بیشتری بدست آورد
261	xIntent	PersonX puts ___ in the way	none	PersonX ___ را سر راه شما قرار می دهد	هیچ یک	PersonX puts ___ in the way. PersonX intends none	PersonX ___ را سر راه شما قرار می دهد. PersonX قصد هیچ کدام را ندارد	PersonX puts ___ in the way	 PersonX intends none	PersonX ___ را سر راه شما قرار می دهد	 PersonX قصد هیچ کدام را ندارد
262	xIntent	PersonX puts ___ in the way	to be difficult.	PersonX ___ را سر راه شما قرار می دهد	سخت بودن	PersonX puts ___ in the way. PersonX intends to be difficult.	PersonX ___ را سر راه شما قرار می دهد. PersonX قصد دارد دشوار باشد.	PersonX puts ___ in the way	 PersonX intends to be difficult	PersonX ___ را سر راه شما قرار می دهد	 PersonX قصد دارد دشوار باشد
263	xIntent	PersonX puts ___ in the way	to prevent something	PersonX ___ را سر راه شما قرار می دهد	برای جلوگیری از چیزی	PersonX puts ___ in the way. PersonX intends to prevent something	PersonX ___ را سر راه شما قرار می دهد. PersonX قصد دارد از چیزی جلوگیری کند	PersonX puts ___ in the way	 PersonX intends to prevent something	PersonX ___ را سر راه شما قرار می دهد	 PersonX قصد دارد از چیزی جلوگیری کند
264	xIntent	PersonX defines PersonY's ___ in terms	to be defines persony	PersonX ___ PersonY را بر اساس اصطلاحات تعریف می کند	شخصیت بودن را تعریف می کند	PersonX defines PersonY's ___ in terms. PersonX intends to be defines persony	PersonX ___ PersonY را بر اساس اصطلاحات تعریف می کند. PersonX قصد دارد شخصیتی را تعریف کند	PersonX defines PersonY's ___ in terms	 PersonX intends to be defines persony	PersonX ___ PersonY را بر اساس اصطلاحات تعریف می کند	 PersonX قصد دارد شخصیتی را تعریف کند
265	xIntent	PersonX defines PersonY's ___ in terms	to be helpful to persony	PersonX ___ PersonY را بر اساس اصطلاحات تعریف می کند	برای شخصیتی مفید باشد	PersonX defines PersonY's ___ in terms. PersonX intends to be helpful to persony	PersonX ___ PersonY را بر اساس اصطلاحات تعریف می کند. PersonX قصد دارد برای شخص مفید باشد	PersonX defines PersonY's ___ in terms	 PersonX intends to be helpful to persony	PersonX ___ PersonY را بر اساس اصطلاحات تعریف می کند	 PersonX قصد دارد برای شخص مفید باشد
266	xIntent	PersonX fights the ___ alone	war	PersonX به تنهایی با ___ می جنگد	جنگ	PersonX fights the ___ alone. PersonX intends war	PersonX به تنهایی با ___ می جنگد. PersonX قصد جنگ دارد	PersonX fights the ___ alone	 PersonX intends war	PersonX به تنهایی با ___ می جنگد	 PersonX قصد جنگ دارد
267	xIntent	PersonX fights the ___ alone	to be heroic	PersonX به تنهایی با ___ می جنگد	قهرمانانه بودن	PersonX fights the ___ alone. PersonX intends to be heroic	PersonX به تنهایی با ___ می جنگد. PersonX قصد دارد قهرمانانه باشد	PersonX fights the ___ alone	 PersonX intends to be heroic	PersonX به تنهایی با ___ می جنگد	 PersonX قصد دارد قهرمانانه باشد
268	xIntent	PersonX fights the ___ alone	to keep others safe	PersonX به تنهایی با ___ می جنگد	برای حفظ امنیت دیگران	PersonX fights the ___ alone. PersonX intends to keep others safe	PersonX به تنهایی با ___ می جنگد. PersonX قصد دارد دیگران را در امان نگه دارد	PersonX fights the ___ alone	 PersonX intends to keep others safe	PersonX به تنهایی با ___ می جنگد	 PersonX قصد دارد دیگران را در امان نگه دارد
269	xIntent	PersonX treats parkinson 's ___	to be a good person	PersonX پارکینسون را درمان می کند ___	آدم خوبی بودن	PersonX treats parkinson 's ___. PersonX intends to be a good person	PersonX پارکینسون را درمان می کند ___. PersonX قصد دارد فرد خوبی باشد	PersonX treats parkinson 's ___	 PersonX intends to be a good person	PersonX پارکینسون را درمان می کند ___	 PersonX قصد دارد فرد خوبی باشد
270	xIntent	PersonX treats parkinson 's ___	to help their patient	PersonX پارکینسون را درمان می کند ___	برای کمک به بیمار خود	PersonX treats parkinson 's ___. PersonX intends to help their patient	PersonX پارکینسون را درمان می کند ___. PersonX قصد دارد به بیمار خود کمک کند	PersonX treats parkinson 's ___	 PersonX intends to help their patient	PersonX پارکینسون را درمان می کند ___	 PersonX قصد دارد به بیمار خود کمک کند
271	xIntent	PersonX drives home PersonX's ___	to do the right thing	PersonX به خانه می رود PersonX's ___	انجام کار درست	PersonX drives home PersonX's ___. PersonX intends to do the right thing	PersonX خانه PersonX را ___ هدایت می کند. PersonX قصد دارد کار درست را انجام دهد	PersonX drives home PersonX's ___	 PersonX intends to do the right thing	PersonX خانه PersonX را ___ هدایت می کند	 PersonX قصد دارد کار درست را انجام دهد
272	xIntent	PersonX drives home PersonX's ___	to justify their message	PersonX به خانه می رود PersonX's ___	برای توجیه پیام آنها	PersonX drives home PersonX's ___. PersonX intends to justify their message	PersonX خانه PersonX را ___ هدایت می کند. PersonX قصد دارد پیام خود را توجیه کند	PersonX drives home PersonX's ___	 PersonX intends to justify their message	PersonX خانه PersonX را ___ هدایت می کند	 PersonX قصد دارد پیام خود را توجیه کند
273	xIntent	PersonX fires another ___	fear	PersonX یکی دیگر را ___ اخراج می کند	ترس	PersonX fires another ___. PersonX intends fear	PersonX یکی دیگر را ___ اخراج می کند. PersonX قصد ترس دارد	PersonX fires another ___	 PersonX intends fear	PersonX یکی دیگر را ___ اخراج می کند	 PersonX قصد ترس دارد
274	xIntent	PersonX fires another ___	to make sure they hit their mark	PersonX یکی دیگر را ___ اخراج می کند	تا مطمئن شوند که آنها به مارک خود ضربه زده اند	PersonX fires another ___. PersonX intends to make sure they hit their mark	PersonX یکی دیگر را ___ اخراج می کند. PersonX قصد دارد مطمئن شود که آنها به مارک خود ضربه زده اند	PersonX fires another ___	 PersonX intends to make sure they hit their mark	PersonX یکی دیگر را ___ اخراج می کند	 PersonX قصد دارد مطمئن شود که آنها به مارک خود ضربه زده اند
275	xIntent	PersonX measures accurately the ___	to be precise.	PersonX ___ را دقیق اندازه می گیرد	دقیق بودن	PersonX measures accurately the ___. PersonX intends to be precise.	PersonX ___ را دقیق اندازه می گیرد. PersonX قصد دارد دقیق باشد.	PersonX measures accurately the ___	 PersonX intends to be precise	PersonX ___ را دقیق اندازه می گیرد	 PersonX قصد دارد دقیق باشد
276	xIntent	PersonX measures accurately the ___	to bake a cake	PersonX ___ را دقیق اندازه می گیرد	برای پختن کیک	PersonX measures accurately the ___. PersonX intends to bake a cake	PersonX ___ را دقیق اندازه می گیرد. PersonX قصد دارد یک کیک بپزد	PersonX measures accurately the ___	 PersonX intends to bake a cake	PersonX ___ را دقیق اندازه می گیرد	 PersonX قصد دارد یک کیک بپزد
277	xIntent	PersonX helps ___ with dyslexia	to help other people	PersonX به ___ در نارساخوانی کمک می کند	برای کمک به افراد دیگر	PersonX helps ___ with dyslexia. PersonX intends to help other people	PersonX به ___ در نارساخوانی کمک می کند. PersonX قصد دارد به افراد دیگر کمک کند	PersonX helps ___ with dyslexia	 PersonX intends to help other people	PersonX به ___ در نارساخوانی کمک می کند	 PersonX قصد دارد به افراد دیگر کمک کند
278	xIntent	PersonX helps ___ with dyslexia	to be a good teacher	PersonX به ___ در نارساخوانی کمک می کند	معلم خوب بودن	PersonX helps ___ with dyslexia. PersonX intends to be a good teacher	PersonX به ___ در نارساخوانی کمک می کند. PersonX قصد دارد یک معلم خوب باشد	PersonX helps ___ with dyslexia	 PersonX intends to be a good teacher	PersonX به ___ در نارساخوانی کمک می کند	 PersonX قصد دارد یک معلم خوب باشد
279	xIntent	PersonX puts ___ into practice	order in the workplace	PersonX ___ را عملی می کند	نظم در محل کار	PersonX puts ___ into practice. PersonX intends order in the workplace	PersonX ___ را عملی می کند. PersonX قصد نظم در محل کار را دارد	PersonX puts ___ into practice	 PersonX intends order in the workplace	PersonX ___ را عملی می کند	 PersonX قصد نظم در محل کار را دارد
280	xIntent	PersonX puts ___ into practice	to implement new ideas he built, hence he applied new ideas	PersonX ___ را عملی می کند	برای پیاده سازی ایده های جدیدی که ساخته است ، از این رو ایده های جدیدی را به کار گرفت	PersonX puts ___ into practice. PersonX intends to implement new ideas he built, hence he applied new ideas	PersonX ___ را عملی می کند. PersonX قصد دارد ایده های جدیدی را که ساخته ساخته پیاده کند ، از این رو ایده های جدیدی را به کار می گیرد	PersonX puts ___ into practice	 PersonX intends to implement new ideas he built, hence he applied new ideas	PersonX ___ را عملی می کند	 PersonX قصد دارد ایده های جدیدی را که ساخته ساخته پیاده کند ، از این رو ایده های جدیدی را به کار می گیرد
281	xIntent	PersonX sets ___ to paper	write on the paper	PersonX ___ را روی کاغذ تنظیم می کند	روی کاغذ بنویس	PersonX sets ___ to paper. PersonX intends write on the paper	PersonX ___ را روی کاغذ تنظیم می کند. PersonX قصد دارد روی کاغذ بنویسد	PersonX sets ___ to paper	 PersonX intends write on the paper	PersonX ___ را روی کاغذ تنظیم می کند	 PersonX قصد دارد روی کاغذ بنویسد
282	xIntent	PersonX likes the ___ much	likes the kids much	PersonX ___ را بسیار دوست دارد	بچه ها را خیلی دوست دارد	PersonX likes the ___ much. PersonX intends likes the kids much	PersonX ___ را بسیار دوست دارد. PersonX قصد دارد بچه ها را خیلی دوست داشته باشد	PersonX likes the ___ much	 PersonX intends likes the kids much	PersonX ___ را بسیار دوست دارد	 PersonX قصد دارد بچه ها را خیلی دوست داشته باشد
283	xIntent	PersonX leaves PersonY's ___ behind	to be free of weapons	PersonX ___ PersonY را پشت سر می گذارد	بدون اسلحه	PersonX leaves PersonY's ___ behind. PersonX intends to be free of weapons	PersonX ___ PersonY را پشت سر می گذارد. PersonX قصد دارد بدون سلاح باشد	PersonX leaves PersonY's ___ behind	 PersonX intends to be free of weapons	PersonX ___ PersonY را پشت سر می گذارد	 PersonX قصد دارد بدون سلاح باشد
284	xIntent	PersonX leaves PersonY's ___ behind	not to be encumbered by others	PersonX ___ PersonY را پشت سر می گذارد	گرفتار دیگران نشوند	PersonX leaves PersonY's ___ behind. PersonX intends not to be encumbered by others	PersonX ___ PersonY را پشت سر می گذارد. PersonX قصد دارد که توسط دیگران سنگین نشود	PersonX leaves PersonY's ___ behind	 PersonX intends not to be encumbered by others	PersonX ___ PersonY را پشت سر می گذارد	 PersonX قصد دارد که توسط دیگران سنگین نشود
285	xIntent	PersonX leaves PersonY's ___ behind	no part of persony	PersonX ___ PersonY را پشت سر می گذارد	هیچ بخشی از شخصیت	PersonX leaves PersonY's ___ behind. PersonX intends no part of persony	PersonX ___ PersonY را پشت سر می گذارد. PersonX هیچ بخشی از شخصیت را در نظر ندارد	PersonX leaves PersonY's ___ behind	 PersonX intends no part of persony	PersonX ___ PersonY را پشت سر می گذارد	 PersonX هیچ بخشی از شخصیت را در نظر ندارد
286	xIntent	PersonX pushes the ___ aside	another branch	PersonX ___ را کنار می زند	یک شاخه دیگر	PersonX pushes the ___ aside. PersonX intends another branch	PersonX ___ را کنار می زند. PersonX شعبه دیگری را در نظر دارد	PersonX pushes the ___ aside	 PersonX intends another branch	PersonX ___ را کنار می زند	 PersonX شعبه دیگری را در نظر دارد
287	xIntent	PersonX pushes the ___ aside	the sunlight to come into the room	PersonX ___ را کنار می زند	نور خورشید به داخل اتاق می آید	PersonX pushes the ___ aside. PersonX intends the sunlight to come into the room	PersonX ___ را کنار می زند. PersonX قصد دارد نور خورشید به داخل اتاق بیاید	PersonX pushes the ___ aside	 PersonX intends the sunlight to come into the room	PersonX ___ را کنار می زند	 PersonX قصد دارد نور خورشید به داخل اتاق بیاید
288	xIntent	PersonX pushes the ___ aside	to get __ out of the way	PersonX ___ را کنار می زند	__ از سر راه بردن	PersonX pushes the ___ aside. PersonX intends to get __ out of the way	PersonX ___ را کنار می زند. PersonX قصد دارد __ را از سر راه خود دور کند	PersonX pushes the ___ aside	 PersonX intends to get __ out of the way	PersonX ___ را کنار می زند	 PersonX قصد دارد __ را از سر راه خود دور کند
289	xIntent	PersonX lives PersonX's ___ in PersonX's way	honest	PersonX به شیوه PersonX با ___ PersonX زندگی می کند	صادقانه	PersonX lives PersonX's ___ in PersonX's way. PersonX intends honest	PersonX به شیوه PersonX با ___ PersonX زندگی می کند. PersonX قصد دارد صادقانه باشد	PersonX lives PersonX's ___ in PersonX's way	 PersonX intends honest	PersonX به شیوه PersonX با ___ PersonX زندگی می کند	 PersonX قصد دارد صادقانه باشد
290	xIntent	PersonX lives PersonX's ___ in PersonX's way	to be his own man	PersonX به شیوه PersonX با ___ PersonX زندگی می کند	مرد خودش باشد	PersonX lives PersonX's ___ in PersonX's way. PersonX intends to be his own man	PersonX به شیوه PersonX با ___ PersonX زندگی می کند. PersonX قصد دارد که شخص خودش باشد	PersonX lives PersonX's ___ in PersonX's way	 PersonX intends to be his own man	PersonX به شیوه PersonX با ___ PersonX زندگی می کند	 PersonX قصد دارد که شخص خودش باشد
291	xIntent	PersonX lives PersonX's ___ in PersonX's way	to decide his own fate	PersonX به شیوه PersonX با ___ PersonX زندگی می کند	برای سرنوشت خود تصمیم بگیرد	PersonX lives PersonX's ___ in PersonX's way. PersonX intends to decide his own fate	PersonX به شیوه PersonX با ___ PersonX زندگی می کند. PersonX قصد دارد تا درباره سرنوشت خود تصمیم بگیرد	PersonX lives PersonX's ___ in PersonX's way	 PersonX intends to decide his own fate	PersonX به شیوه PersonX با ___ PersonX زندگی می کند	 PersonX قصد دارد تا درباره سرنوشت خود تصمیم بگیرد
292	xIntent	PersonX lives PersonX's ___ in PersonX's way	doesn't trust others	PersonX به شیوه PersonX با ___ PersonX زندگی می کند	به دیگران اعتماد ندارد	PersonX lives PersonX's ___ in PersonX's way. PersonX intends doesn't trust others	PersonX به شیوه PersonX با ___ PersonX زندگی می کند. PersonX قصد دارد به دیگران اعتماد نکند	PersonX lives PersonX's ___ in PersonX's way	 PersonX intends doesn't trust others	PersonX به شیوه PersonX با ___ PersonX زندگی می کند	 PersonX قصد دارد به دیگران اعتماد نکند
293	xIntent	PersonX avenges PersonY's father 's ___	to teach a lesson	PersonX انتقام ___ پدر PersonY را می گیرد	درس دادن	PersonX avenges PersonY's father 's ___. PersonX intends to teach a lesson	PersonX انتقام ___ پدر PersonY را می گیرد. PersonX قصد دارد یک درس بدهد	PersonX avenges PersonY's father 's ___	 PersonX intends to teach a lesson	PersonX انتقام ___ پدر PersonY را می گیرد	 PersonX قصد دارد یک درس بدهد
294	xIntent	PersonX avenges PersonY's father 's ___	to have justice	PersonX انتقام ___ پدر PersonY را می گیرد	عدالت داشتن	PersonX avenges PersonY's father 's ___. PersonX intends to have justice	PersonX انتقام ___ پدر PersonY را می گیرد. PersonX قصد دارد عدالت داشته باشد	PersonX avenges PersonY's father 's ___	 PersonX intends to have justice	PersonX انتقام ___ پدر PersonY را می گیرد	 PersonX قصد دارد عدالت داشته باشد
295	xIntent	PersonX avenges PersonY's father 's ___	revenge for someone	PersonX انتقام ___ پدر PersonY را می گیرد	انتقام کسی	PersonX avenges PersonY's father 's ___. PersonX intends revenge for someone	PersonX انتقام ___ پدر PersonY را می گیرد. PersonX قصد انتقام از شخصی را دارد	PersonX avenges PersonY's father 's ___	 PersonX intends revenge for someone	PersonX انتقام ___ پدر PersonY را می گیرد	 PersonX قصد انتقام از شخصی را دارد
296	xIntent	PersonX avenges PersonY's father 's ___	father's support	PersonX انتقام ___ پدر PersonY را می گیرد	حمایت پدر	PersonX avenges PersonY's father 's ___. PersonX intends father's support	PersonX انتقام ___ پدر PersonY را می گیرد. PersonX قصد حمایت پدر را دارد	PersonX avenges PersonY's father 's ___	 PersonX intends father's support	PersonX انتقام ___ پدر PersonY را می گیرد	 PersonX قصد حمایت پدر را دارد
297	xIntent	PersonX assesses children 's ___	to be helpful.	PersonX ___ کودکان را ارزیابی می کند	مفید بودن	PersonX assesses children 's ___. PersonX intends to be helpful.	PersonX ___ کودکان را ارزیابی می کند. PersonX قصد دارد مفید واقع شود.	PersonX assesses children 's ___	 PersonX intends to be helpful	PersonX ___ کودکان را ارزیابی می کند	 PersonX قصد دارد مفید واقع شود
298	xIntent	PersonX assesses children 's ___	to perform and avoid critical situations	PersonX ___ کودکان را ارزیابی می کند	برای انجام و جلوگیری از شرایط بحرانی	PersonX assesses children 's ___. PersonX intends to perform and avoid critical situations	PersonX ___ کودکان را ارزیابی می کند. PersonX قصد دارد شرایط بحرانی را انجام داده و از آنها اجتناب کند	PersonX assesses children 's ___	 PersonX intends to perform and avoid critical situations	PersonX ___ کودکان را ارزیابی می کند	 PersonX قصد دارد شرایط بحرانی را انجام داده و از آنها اجتناب کند
299	xIntent	PersonX adds ___ to the flame	to start an argument	PersonX ___ را به شعله اضافه می کند	برای شروع بحث	PersonX adds ___ to the flame. PersonX intends to start an argument	PersonX ___ را به شعله اضافه می کند. PersonX قصد دارد بحثی را آغاز کند	PersonX adds ___ to the flame	 PersonX intends to start an argument	PersonX ___ را به شعله اضافه می کند	 PersonX قصد دارد بحثی را آغاز کند
